{
  "$schema": "https://github.com/Albadry-Esmat/AI-Workflow/schemas/runtime-prerequisites-schema.json",
  "schema_version": "1.0.0",
  "ownership": "ai-workflow-declares-operator-owns",
  "boundary": "Declare → Verify → Consume → Execute. Never Install → Connect → Authenticate → Configure.",
  "installation_owner": "operator/runtime",
  "managed_by_aiw": false,
  "prerequisites": [
    {
      "id": "agent-runtime",
      "required_runtime": "opencode | claude-code | codex | copilot-cli | antigravity | cursor | gemini-cli | aider | generic-command",
      "required_capability": "model_execution",
      "installation_owner": "operator/runtime",
      "managed_by_aiw": false,
      "verification": "read-only executable presence + version probe; never install, login, or configure",
      "notes": "How the runtime is installed belongs to the operator/runtime. AIW only verifies availability and consumes the existing connection."
    },
    {
      "id": "provider-authentication",
      "required_runtime": "selected-agent-runtime",
      "required_capability": "authenticated_model_execution",
      "installation_owner": "operator/runtime",
      "managed_by_aiw": false,
      "verification": "delegated redacted status only (authenticated/unauthenticated); raw secrets never handled",
      "notes": "AIW declares that a capability requires an authenticated runtime and consumes values already provided by the environment. It never generates, requests, stores, rotates, logs in with, or configures credentials."
    }
  ]
}
